created_at,text,favorite_count,retweet_count,source,id
2017-07-29 04:19:58,"Trans Nzoia, Kericho na Narok - Tuko Pamoja! https://t.co/sIAj4vSuLh",263,71,Twitter for Android,891151289240965120
2017-07-28 16:04:12,Ukweli wa mambo - Kapsabet. https://t.co/X3We6mLgh6,404,147,Twitter Web Client,890966127064567809
2017-07-28 15:40:35,Ukweli wa mambo - blame game. https://t.co/emN21gMdLV,464,144,Twitter Web Client,890960182586593280
2017-07-28 14:04:23,Addressed wananchi in Kapsabet #NandiCountyNiJubilee https://t.co/1hJuMgGoSe,306,89,Twitter for Android,890935974154424320
2017-07-28 13:11:27,"I have delivered on my promises to Western Kenya 
  https://t.co/sNjJh29lLP",204,55,Twitter Web Client,890922650507333633
2017-07-28 12:37:15,Addressed wananchi in Borabu #NyamiraNiJubilee https://t.co/cUruPRm997,356,92,Twitter for Android,890914047012503557
2017-07-28 11:58:11,#MigoriNiJubilee https://t.co/XdQrmgDsKu,317,100,Twitter for Android,890904212938387456
2017-07-28 11:57:50,"RT @inuajamiike: 1,372 older persons already registered on the on going #inuajamii70 and above in Trans Nzoia county #GoKDELIVERS @PDUDeliv…",0,30,Twitter for Android,890904126682431488
2017-07-28 11:56:58,"RT @PDUDelivery: Vihiga county has7,976 beneficiaries of CTOVC program (orphans and vulnerable children)#GoKDELIVERS #Inuajamii70",0,27,Twitter for Android,890903907727282176
2017-07-28 11:20:58,We have also expanded electricity connectivity which is aimed at enabling Kenyans operate businesses way into the night.,205,58,Twitter for Android,890894847867056128
2017-07-28 11:19:51,We have upgraded at least 2 hospitals in every county so that they have equipment that can handle issues that usually require referral.,202,56,Twitter for Android,890894567909863424
2017-07-28 11:19:06,"We have constructed the Standard Gauge Railway and built more than 7,000 kilometres of tarmac roads. https://t.co/KuoD8EGJUv",261,83,Twitter for Android,890894379233284096
2017-07-28 11:17:58,The Jubilee government has already made strides in improving the country's infrastructure network. https://t.co/6hw8oceeVK,202,71,Twitter for Android,890894092078649345
2017-07-28 10:13:41,"The alternative is weak, whose divisive leadership is more concerned with grabbing power than delivering credible p… https://t.co/ue5zbngQjA",213,64,Twitter Web Client,890877914895536128
2017-07-28 10:09:10,The only way we can secure better and improved lives for all Kenyans is to ensure that I can finish the job started. https://t.co/6d85PlIBPy,480,119,Twitter Web Client,890876778495045632
2017-07-28 08:55:52,Kenya is the only nation in Africa selected to take part in this year's international Technovation competition. https://t.co/0iznV9OvcU,646,234,Twitter Web Client,890858332554244097
2017-07-28 08:55:25,They will be flying to Google HQ in California on August 6th for their  I-cut app that seeks to end Female Genital… https://t.co/drmseqa6DU,317,130,Twitter Web Client,890858219287052291
2017-07-28 08:55:03,Met the 'Restorers' five brilliant young students from Kisumu Girls High  School. https://t.co/ddsn1Pw9sX,281,84,Twitter Web Client,890858125091368961
2017-07-28 08:46:32,...to enhanced medical services-from greater electricity connectivity and better roads to revived industries. https://t.co/8WXriAZI0j,295,72,Twitter Web Client,890855985228787712
2017-07-28 08:46:04,During an interview in Kakamega. Jubilee's development programmes in Western Kenya range from infrastructure develo… https://t.co/FVrgQpRiHe,232,69,Twitter Web Client,890855867339464704
2017-07-28 02:53:08,Tuko Pamoja! https://t.co/VfhAv5YZAe,358,94,Twitter for Android,890767047386378241
2017-07-27 16:00:57,"If our opponents indeed cared about Kenyans and wanted change, they would have brought that change when they were r… https://t.co/P15LcYgPuj",1005,230,Twitter Web Client,890602920214896642
2017-07-27 15:59:00,The leaders of the opposition are trying to hoodwink their followers with false promises of change. https://t.co/SPqOlwkBpE,432,94,Twitter Web Client,890602429221416960
2017-07-27 15:49:37,Urged residents of Adungosi to rally behind me so that the country would have the right leader who will work selfle… https://t.co/YluPENCjKm,283,76,Twitter Web Client,890600069933678593
2017-07-27 13:56:34,Let us not put our country at risk under the leadership of NASA who only care about themselves. https://t.co/z4rCX1X3Qz,582,151,Twitter Web Client,890571620296871937
2017-07-27 13:52:24,The alternative is an opposition focused almost entirely on taking and dividing power. https://t.co/MV4QRnsSQJ,340,78,Twitter Web Client,890570571288903681
2017-07-27 13:50:55,"The choice on 8 Aug is btw my Action Plan that will deliver benefits, success &amp; prosperity to every Kenyan changing… https://t.co/xlwInTwqUU",287,87,Twitter Web Client,890570196917899264
2017-07-27 12:48:24,The Jubilee Administration is action oriented and Kenyans have benefited from its initiatives. https://t.co/c2fTsIF2pZ,291,84,Twitter Web Client,890554464939147265
2017-07-27 12:45:02,The issuing of title deeds to more than 3.5 million Kenyans is proof that we are committed to solve the land proble… https://t.co/j56JBuRRIy,311,102,Twitter Web Client,890553616247001093
2017-07-27 12:31:32,Jubilee made great strides in four years https://t.co/SBuENA6jAL https://t.co/yVR2p9pi24,299,96,Twitter Web Client,890550220022587392
2017-07-27 09:53:50,Traffic department is set for reforms to curb graft https://t.co/AMkHSgejRK https://t.co/y7MgVzup2H,248,61,Twitter Web Client,890510531911667712
2017-07-27 09:52:52,We must get rid of the illegal collection of money by traffic police officers because that is part of what makes it… https://t.co/q0hlHTeAsb,765,198,Twitter Web Client,890510288516239360
2017-07-27 09:52:17,I assured the association that we are going to reorganise the traffic department in order to make it more accountab… https://t.co/ljITr2UcEy,224,64,Twitter Web Client,890510144093683712
2017-07-27 09:48:28,"Meeting with the Matatu Owners' Association when I hosted them for breakfast at State House, Nairobi. https://t.co/IfGM9a6Lc3",239,74,Twitter Web Client,890509181454872576
2017-07-27 06:04:35,Tuko Pamoja! https://t.co/sV7TVk2GAI,403,98,Twitter for Android,890452838853332993
2017-07-26 15:32:39,Launched upgrade works to bitumen standard of the Nabor-Kisima-Maralal (A4) road. https://t.co/w3W5yZkpha,294,73,Twitter Web Client,890233410177859584
2017-07-26 15:12:01,Addressed wananchi in Maralal and urged them to vote for Jubilee so that we can continue with our work to make Keny… https://t.co/Qdvx2HOjO7,279,72,Twitter for Android,890228219437338624
2017-07-26 13:58:43,It would also mean a weakened economy translating to fewer jobs and higher prices. https://t.co/wqjQ3TjRfB,201,53,Twitter for Android,890209771772665856
2017-07-26 13:57:36,His divisive leadership would mean chaos for Kenya and no peace and security for you and your family. https://t.co/RliGxYB1bm,323,96,Twitter for Android,890209489336631297
2017-07-26 13:56:35,Raila cares only about power for himself and playing politics to get power. He has no credible plan and only compla… https://t.co/VlDprl0woU,746,295,Twitter for Android,890209234335539200
2017-07-26 13:55:58,Choose Jubilee for progress and say a resounding NO to NASA because of the risk they pose as merchants of divisive… https://t.co/RXuhgRcinu,315,117,Twitter for Android,890209080404578304
2017-07-26 13:54:57,On the 8th of August all Kenyans have to make a decisive decision. The difference between NASA and Jubilee is like… https://t.co/RBQMEz2Vuc,216,79,Twitter for Android,890208824401031171
2017-07-26 13:25:23,Commissioned the construction of a modern stadium in Marsabit town. https://t.co/x01U1DcOd1,346,120,Twitter for Android,890201382426476550
2017-07-26 13:16:30,"The next phase of my transformational agenda is to implement an action plan to create more jobs,lower prices and en… https://t.co/IgeGxnxEVg",265,67,Twitter for Android,890199147147657216
2017-07-26 13:15:03,The investments in the northern region are part of my Administration’s work to lay down the foundations for progres… https://t.co/Yvngc2rnlW,142,43,Twitter for Android,890198783220473856
2017-07-26 13:13:12,The Jubilee Administration has a genuine concern to solve the problems facing the people of the region who were neg… https://t.co/sgOvatxT4D,136,35,Twitter for Android,890198317556170752
2017-07-26 13:12:29,We have changed the face of Northern Kenya https://t.co/vxJmGxipIJ https://t.co/3WIrIRaP0z,146,47,Twitter for Android,890198137943576578
2017-07-26 12:49:12,"RT @SicilyKariuki: #WomenKE

More than 500,000 women have undergone training on entrepreneurship  and financial management in the last four…",0,66,Twitter Web Client,890192277406089216
2017-07-26 12:47:21,"RT @SicilyKariuki: The National Government Affirmative Action Fund has had an allocation of 6.180B in the last 3 years.  Cc 
 @NGAAF_KE

#W…",0,63,Twitter Web Client,890191811641311232
2017-07-26 12:46:59,"RT @SicilyKariuki: Under Women Enterprise Fund, Women countrywide have received 10.6Billion since inception of the fund,

#WomenKe 
#GoKDEL…",0,65,Twitter Web Client,890191717605003264
2017-07-26 11:46:36,Rather they will enjoy all services like other Kenyan citizens #MoyaleNiJubilee https://t.co/jfiBwx3SDr,275,62,Twitter Web Client,890176523751366656
2017-07-26 11:43:16,"Once all Jubilee programmes are complete, Moyale residents will not be waking up saying they are going to Kenya… https://t.co/es5FaQdSHr",237,56,Twitter Web Client,890175685947523073
2017-07-26 11:38:08,Addressed Moyale town residents after commissioning the Kshs 42 billion Isiolo-Moyale road which connects Kenya to… https://t.co/3lMYEyAnwW,382,127,Twitter Web Client,890174394101895169
2017-07-26 10:59:45,Improving our infrastructure has been our priority to ensure that we attract investors that will result in more qua… https://t.co/CsbOOzVNM4,286,65,Twitter Web Client,890164733285945344
2017-07-26 10:50:00,"Commissioning the Turbi-Moyale (A2) road in Moyale Town, Marsabit County. https://t.co/WoF7c6crj1",290,83,Twitter Web Client,890162280196972544
2017-07-26 07:42:56,Tuko Pamoja! https://t.co/w8z0H0IQdk,339,73,Twitter for Android,890115203282685954
2017-07-25 17:05:41,"Delivered my promise of a school bus to Gitweku Girls Secondary School when I met them in Kangema, Murang'a County. https://t.co/oNPjbujQqr",512,106,Twitter Web Client,889894435223457794
2017-07-25 15:54:06,Kenyans should campaign and vote in peace without fear of any violence during or after the August 8 election. https://t.co/UHXn7CPFs4,390,140,Twitter Web Client,889876421014933504
2017-07-25 15:51:11,I urge Kenyans to reject attempts by self-centered politicians who want to create hatred and ethnic tensions to win… https://t.co/20U9chiTJl,342,113,Twitter Web Client,889875684927168516
2017-07-25 15:40:40,Turn out in large numbers on August 8th and vote for my re-election https://t.co/YY2z4kl3Ot https://t.co/jJhotja2fW,345,97,Twitter Web Client,889873038593937408
2017-07-25 15:14:03,Our opponents divisive leadership would mean a weakened economy which will result in fewer jobs for Kenyans and hig… https://t.co/lop7kYxXzj,351,95,Twitter Web Client,889866339925598209
2017-07-25 14:29:32,I ask Kenyans to endeavour to give me another opportunity to finish what I have started. https://t.co/jIWifqsYbk,628,158,Twitter Web Client,889855140781596672
2017-07-25 13:28:29,My action plan for more jobs and lower prices guarantees real benefits for every Kenyan across the country. https://t.co/u18095WiTC,336,84,Twitter Web Client,889839774072270849
2017-07-25 12:14:57,During my return to Nyeri &amp; Murang'a counties to meet with the residents &amp; share my Action Plan that will deliver p… https://t.co/hBCp931bWO,301,74,Twitter for iPad,889821271126675456
2017-07-25 11:57:28,The choice for Kenyans on 8 August is between economic progression that I have laid a strong foundation for vs. ret… https://t.co/oVqGf1SFUR,470,140,Twitter for iPad,889816871150788608
2017-07-25 10:00:17,RT @StateHouseKenya: SPOKESPERSON’S STATEMENT https://t.co/hOZEu8kD8Q,0,26,Twitter for Android,889787380663803904
2017-07-25 06:45:33,Tuko Pamoja! https://t.co/97qoUnGq3K,797,194,Twitter for Android,889738375263133697
2017-07-24 17:25:11,"Whatever problems there are, let us resolve them peacefully to the satisfaction of the people of Baringo, West Poko… https://t.co/PtX2Frrkpl",996,286,Twitter Web Client,889536955108777986
2017-07-24 17:24:36,I swore to protect all lives and all property in Kenya. That is a point you must always take to mind. https://t.co/NNW2z4PkC4,1124,357,Twitter Web Client,889536808912134146
2017-07-24 17:24:05,Attacks on people and destruction of property won’t go unpunished https://t.co/pFGwmU9zOL https://t.co/4PXR2cF4mx,465,148,Twitter Web Client,889536677663969280
2017-07-23 19:33:04,"@MinistriesAlpha You embody both resilience and talent, two of our country's greatest qualities. My office will con… https://t.co/dIMFD7NIfi",77,38,Twitter for Android,889206750376857601
2017-07-23 16:25:39,Meeting the residents of Isiolo Town. We have laid the foundations for prosperity and now we need to finish the job. https://t.co/1L5brt6xic,375,86,Twitter for iPad,889159583851261953
2017-07-23 16:05:19,The airport is a catalyst to economic development that will come with the expansion of tourism and creation of qual… https://t.co/QMZi0gmejv,350,102,Twitter for iPad,889154469073752065
2017-07-23 16:04:02,"The airport is strategically located for miraa, beef and fresh produce exports from Kenya’s Lower Eastern region. https://t.co/EW8NNlQ9hB",300,115,Twitter for iPad,889154143109173248
2017-07-23 16:02:19,"Commissioned the Kshs 2.5 billion Isiolo International Airport, a key plank of the LAPSSET Corridor project. https://t.co/j7Kj4MfCgz",330,141,Twitter for iPad,889153713264361473
2017-07-23 13:19:27,"With my Action Plan, I will take immediate action to ensure that this progress means a lower cost of living for you and your family.",396,97,Twitter Web Client,889112725128982528
2017-07-23 13:18:53,And we’ve taken the fight to Al-Shabaab to make this country safer for every Kenyan family.,269,66,Twitter Web Client,889112585265700864
2017-07-23 13:18:42,We’ve ensured more Kenyans have access to quality education and healthcare.,291,72,Twitter Web Client,889112536456593408
2017-07-23 13:17:32,"We've invested in infrastructure,roads,rail &amp; electricity to support job-creating businesses &amp; help farmers deliver their produce to market.",286,99,Twitter Web Client,889112243551522817
2017-07-23 13:14:56,Over the last 4 years my administration has built the foundations for prosperity and created over 2.5 million new j… https://t.co/owBJNxB5KO,290,75,Twitter Web Client,889111591416975361
2017-07-23 13:11:53,Launched my Action Plan to deliver 6.5 million quality jobs within five years https://t.co/OUn3VtrRNa https://t.co/SVSISeLVdZ,235,77,Twitter Web Client,889110820810092544
2017-07-23 12:46:56,"My Action Plan will transform the progress we have made over the last four years, into real benefits for all Kenyan… https://t.co/fI3PmWq8UR",240,81,Twitter for iPad,889104541282697217
2017-07-23 11:05:31,Let us finish the job together #GarissaNiJubilee https://t.co/YF47i83MWw,587,178,Twitter Web Client,889079021539078144
2017-07-23 11:03:56,"I will deliver my Action Plan for more jobs,lower prices &amp; peace &amp; security because I have already delivered the fo… https://t.co/JPOrddyoZG",615,186,Twitter Web Client,889078623399026688
2017-07-23 06:03:04,Looking forward to meeting Garissa &amp; Isiolo residents.Remember to join me on Facebook at 9.30am to ask me any quest… https://t.co/qb4BIBrU9O,416,108,Twitter for Android,889002906761953280
2017-07-22 16:00:55,#ChatwithUhuru https://t.co/8WW0doRV59,456,178,Twitter for Android,888790973312094209
2017-07-22 15:47:53,Let us campaign peacefully. Let us be united. Let our people enjoy a peaceful run-up to elections.,587,219,Twitter Web Client,888787691835453440
2017-07-22 15:42:45,Do not agree to shed your blood for politicians or political causes. https://t.co/5lKsGzNcA6,572,258,Twitter Web Client,888786401759821828
2017-07-22 15:41:09,"I urge all of you, especially the youth not to be deployed in a wrong way by politicians. https://t.co/10nrSW9IxJ",397,139,Twitter Web Client,888785999844835328
2017-07-22 15:18:58,Assured the residents of Wajir that my action plan entails creating shared prosperity across the country leaving no… https://t.co/xNdV5zLwkv,224,85,Twitter Web Client,888780416022433793
2017-07-22 14:18:07,#ChatWithUhuru https://t.co/mUjrLlk74U,387,143,Twitter for Android,888765102173949952
2017-07-22 12:37:17,We have laid the foundations for prosperity and now we need to complete the job. https://t.co/fJ24nVWIuX,284,77,Twitter Web Client,888739724814413824
2017-07-22 12:35:50,Meeting the residents of Mandera. Urged them to give me the mandate to finish what I started. https://t.co/u11QH6qrbx,305,88,Twitter Web Client,888739362694987778
2017-07-22 08:50:11,Join me live on my Facebook page at 9.30am tomorrow to ask me questions about my Action Plan for more jobs and lowe… https://t.co/jMtUPPmAmx,1661,795,Twitter for Android,888682573584625664
2017-07-22 06:18:39,Looking forward to meeting Mandera and Wajir residents. Tuko Pamoja! https://t.co/44nWHSncaK,371,92,Twitter for Android,888644439673102341
2017-07-21 16:52:52,I urge Kenyans to turn out in large numbers to vote without fear. My action plan guarantees the security of each an… https://t.co/h30jBDngIs,503,187,Twitter Web Client,888441658551013376
2017-07-21 16:13:54,We have worked hard to build a strong foundation for our country in the last four-and-a-half years. Let us finish t… https://t.co/ejjbZhujE8,438,148,Twitter Web Client,888431853396516864
2017-07-21 16:10:39,"We all want prosperity and we want that prosperity to be shared by every Kenyan, across the country. That is not th… https://t.co/P8iKs8wGVl",249,89,Twitter Web Client,888431034999738368
2017-07-21 15:37:19,Addressing residents of Dandora during our meet-the-people tour of Nairobi County. https://t.co/oqPKu6LMGv,313,95,Twitter for iPad,888422647775858692
2017-07-21 14:28:19,The time to restore the glory of Nairobi is now and you hold the key to that change. Vote for Jubilee candidates on… https://t.co/ze5wpwhZsZ,389,129,Twitter for Android,888405283323748353
2017-07-21 14:25:50,Campaigned for Sonko and Igathe and warned against dividing the Nairobi gubernatorial vote https://t.co/waE8BWqhtj https://t.co/H2B5BwdsRQ,341,120,Twitter for Android,888404657470664709
2017-07-21 13:12:17,"I commit to creating at least 6.5 million jobs in the next five years to ensure that our people, particularly the y… https://t.co/C5lbWJvc18",495,134,Twitter Web Client,888386148002930688
2017-07-21 13:10:05,Employment creation is at the heart of my action plan. https://t.co/f2HcIHwPi1,378,77,Twitter Web Client,888385591808851968
2017-07-21 10:34:25,Also signed The President’s Award Bill 2017 and The Companies Amendment Bill 2017. https://t.co/oH0o3TI5FJ,156,51,Twitter Web Client,888346416535523329
2017-07-21 10:33:41,"The Kenya Trade Remedies Bill 2017, The Nairobi International Financial Centre Bill 2017. https://t.co/jzLIkunrmj",131,48,Twitter Web Client,888346235664564225
2017-07-21 10:30:34,"The Occupational Therapists (Training, Registration and Licensing) Bill 2016, The Kenya National Examinations Counc… https://t.co/NlNfW0Cnp8",121,54,Twitter Web Client,888345450205597696
2017-07-21 10:29:24,"Signed into law 8 Bills at State House. Bills included The Traffic (Amendment) Bill 2017, The Parliamentary Powers… https://t.co/XSKc5Qn5k3",157,58,Twitter Web Client,888345154356162560
2017-07-21 10:08:27,Nairobi Tuko Pamoja! https://t.co/vB3W0pUhGF,235,59,Twitter for Android,888339883433086976
2017-07-21 09:50:09,The young athletes have made Kenya proud https://t.co/E5mZ7eiK48 https://t.co/l4xWzlK4En,270,87,Twitter Web Client,888335278045372416
2017-07-21 09:39:42,Received back the national flag from the Under 18 team who recently competed in the IAAF World U18 Championships wh… https://t.co/8MYo13fNnb,312,112,Twitter Web Client,888332650301227009
2017-07-20 16:39:12,"We have lost a great leader. A man who stood firm, a man who was diligent in what he did, a man fully committed and… https://t.co/AYJID5FtAg",274,58,Twitter Web Client,888075829703528450
2017-07-20 16:36:20,There are men and women in this country who quietly but firmly are responsible for what Kenya is today. Nicholas Bi… https://t.co/1pxxmhImk4,470,131,Twitter Web Client,888075110564986880
2017-07-20 12:21:29,Condoling with the family of the late Hon. Nicholas Biwott. May our dear friend rest in eternal peace. https://t.co/lN8HqSraEC,262,70,Twitter Web Client,888010973491154945
2017-07-20 10:50:06,"Met the outgoing Belgian Ambassador to Kenya, H.E. Roxane de Bilderling at State House, Nairobi. https://t.co/1vBDbugcJp",185,47,Twitter for Android,887987978844463106
2017-07-20 10:09:06,"Met Jack Ma, the Founder and Executive Chairman of Alibaba Group. Our discussion revolved around youth empowerment… https://t.co/EXnh3L3e0U",749,322,Twitter for Android,887977661485768706
2017-07-20 09:59:25,But the opposition adamantly refuses to submit itself to that commitment.,288,80,Twitter for Android,887975223689191424
2017-07-20 09:59:13,We have persistently declared that we are ready to accept the will of the people.,620,179,Twitter for Android,887975173080715265
2017-07-20 09:58:40,The opposition is bent on subverting the will of Kenyans https://t.co/BHqODBoJ7Q https://t.co/u58q3PSfKL,168,71,Twitter for Android,887975033083240448
2017-07-20 06:15:16,"RT @URTeamKenya: We will facilitate mass housing production of at least 500,000 low cost affordable homes in 5 years across the country .@W…",0,36,Twitter Web Client,887918814125543424
2017-07-20 06:14:56,"RT @URTeamKenya: Let us transform Kenya, together. Vote Jubilee .@WilliamsRuto https://t.co/CrKGWeci05",0,47,Twitter Web Client,887918729048326144
2017-07-20 06:14:41,"RT @URTeamKenya: .@UKenyatta let us build Kenya, together https://t.co/PT64wPfSzr",0,407,Twitter Web Client,887918666892935168
2017-07-19 16:35:49,#TaitaTaveta ni #Jubilee https://t.co/S8QpsMwnSj,273,85,Twitter Web Client,887712591761608706
2017-07-19 15:42:36,"I want to finish the job of turning the foundations we have laid successfully into delivery of more jobs, lower pri… https://t.co/WL5eSQlQ4h",557,142,Twitter for iPad,887699197889216514
2017-07-19 12:59:52,"Also delivered 20,000 titles to the people of Taveta, fulfilling a pledge I made that I would resolve their outstan… https://t.co/kmb9PFuO9N",287,84,Twitter Web Client,887658247846547456
2017-07-19 12:58:12,"Opened the Sh8.4 billion Mwatate-Taveta road, another flagship Jubilee project in coastal counties… https://t.co/wVwgRZSsbT",344,98,Twitter Web Client,887657829078892545
2017-07-19 11:21:12,I am committed to improving the infrastructure of this country to create more jobs for Kenyans especially our young… https://t.co/4UVYubpcEu,327,93,Twitter for iPad,887633415796928512
2017-07-19 09:55:40,Let us finish the job and ensure food becomes more affordable for all Kenyan families. https://t.co/hsSD4Hu1Kn,450,99,Twitter for iPad,887611890494570499
2017-07-19 09:54:50,Our investment in developing new roads in every county will make it easier to transport food to the market. https://t.co/MakU9MSFaG,290,71,Twitter for iPad,887611679550443520
2017-07-19 09:54:06,We embarked on the massive expansion of our road networks across the country to lay the foundation for a thriving e… https://t.co/R1BFyWEo00,188,55,Twitter for iPad,887611498767536129
2017-07-19 09:52:49,"Launched the dualling of Mombasa-Kwa Jomvu section (Lot 1 of Mombasa-Mariakani (A8) Highway) in Changamwe, Mombasa… https://t.co/MFpZaJTcw3",284,70,Twitter for iPad,887611171725086720
2017-07-19 05:07:03,"Mombasa, Kilifi na Taita Taveta - Tuko Pamoja! https://t.co/VA5mv3rgsp",264,67,Twitter for Android,887539260148129792
2017-07-18 13:36:43,"More jobs for the young, lower prices to reduce the cost of living and a more secure, unified country for you to raise a family in.",482,106,Twitter Web Client,887305131804549121
2017-07-18 13:36:27,My Action Plan takes the progress we have made over the last five years  and turns it into benefits that our youth… https://t.co/4546HueBjs,211,59,Twitter Web Client,887305063865233408
2017-07-18 13:29:39,We have created 2.3 million jobs already since 2013. Now let’s finish the job and create 6.5 million more. https://t.co/u4W0r20BnL,450,129,Twitter Web Client,887303355768471552
2017-07-18 13:25:03,"My Action Plan for more jobs for all Kenyans will ensure that the foundations we have built for prosperity,create m… https://t.co/j2jG2NAN9U",382,109,Twitter Web Client,887302195502342144
2017-07-18 10:43:36,I will deliver this plan because I have already built the foundations for prosperity and now need to finish the job.,402,89,Twitter Web Client,887261566130946048
2017-07-18 10:42:05,"This plan will deliver more jobs, lower prices, and peace and security for all Kenyans.",193,34,Twitter Web Client,887261186047315968
2017-07-18 10:41:42,This is part of my Action Plan to deliver prosperity for all Kenyans.,144,26,Twitter Web Client,887261089611821056
2017-07-18 10:26:48,This has been part of our pledge to enable Kenyans own land and create wealth. https://t.co/RBbUgFYJ9S,201,43,Twitter Web Client,887257339539202048
2017-07-18 10:25:54,"The 300,000 coast titles are part of the more than 3.5 million titles deeds that the Jubilee Government has issued… https://t.co/XNhT7EYFZ8",215,53,Twitter Web Client,887257110643429376
