created_at,text,favorite_count,retweet_count,source,id
2018-03-09 12:51:59,My remarks after a meeting with my brother @RailaOdinga https://t.co/DO1cfl4TvE,531,139,Twitter Web Client,972092634184462336
2018-03-09 12:20:27,"President Kenyatta, NASA leader resolve to work together and unite Kenyans https://t.co/LEthaewdPw https://t.co/WrjSsRCf9W",1701,525,Twitter Web Client,972084697848217600
2018-03-09 10:14:20,Had the great pleasure of welcoming my brother @RailaOdinga to Harambee House where we had the opportunity for exte… https://t.co/kYIGobhuFw,9358,3703,Twitter Web Client,972052961445728258
2018-03-09 07:34:48,RT @MEsipisu: President @UKenyatta will hold a media event at Harambee House 11 am this morning,0,91,Twitter for Android,972012812552810496
2018-03-08 16:21:56,"RT @MEsipisu: President @UKenyatta and @FirstLadyKenya at the launch of Beyond Zero Strategic Framework 2018-2022 at State House, which coi…",0,152,Twitter Web Client,971783081542680577
2018-03-08 15:13:55,RT @FirstLadyKenya: Let us rededicate our energies and our collective resolve to build a healthier and better future for Kenyans. https://t…,0,132,Twitter Web Client,971765968048402434
2018-03-08 15:13:48,RT @FirstLadyKenya: I look forward to consolidating my contribution to support solutions that address the social issues of our nation initi…,0,53,Twitter Web Client,971765937752985600
2018-03-08 13:42:50,RT @FirstLadyKenya: That is why this new Framework is decisively shaped by the lessons its predecessor taught: it is integrated with the Su…,0,59,Twitter Web Client,971743045841575936
2018-03-08 13:42:40,"RT @FirstLadyKenya: We have had the time to think through the broader frameworks under which we work, and the partnerships that make that w…",0,38,Twitter Web Client,971743003344818177
2018-03-08 13:23:56,"RT @FirstLadyKenya: This new Framework adopts a life-cycle approach, addressing challenges at different stages of life as Kenyans move from…",0,51,Twitter Web Client,971738286204116992
2018-03-08 13:23:48,"RT @FirstLadyKenya: We must learn from our experience, through the data, and through listening to our partners — so that we can hasten the…",0,40,Twitter Web Client,971738255577305088
2018-03-08 13:23:43,"RT @FirstLadyKenya: During the launch of @BeyondZeroKenya Strategic Framework 2018-2022 at State House. We believed then, as we do now, tha…",0,41,Twitter Web Client,971738231330037761
2018-03-08 11:16:12,I asked the department to tap their revenue potential so that we can avoid over-reliance on the exchequer.… https://t.co/R2lmVTSDVy,242,51,Twitter Web Client,971706144073818112
2018-03-08 10:29:29,"My Administration is processing 8,000 prisoners for alternative correctional programmes outside the prisons, the be… https://t.co/NsbywJlTdO",329,67,Twitter Web Client,971694384151441408
2018-03-08 10:27:50,"The contribution of all our security agencies is essential.  In this regard, my Administration will continue to inv… https://t.co/MwJ0wDTSrl",140,36,Twitter Web Client,971693969745874944
2018-03-08 10:25:51,"Their presence and their success affirms our commitment to fair opportunity to every Kenyan, whatever your communit… https://t.co/XlgFHJZAAJ",202,45,Twitter Web Client,971693470107815936
2018-03-08 10:22:50,"We proudly send off a contingent of 3,198 young men &amp; women, all of them ready to serve our country as career Priso… https://t.co/7HBwy7iMCh",327,64,Twitter Web Client,971692713103036416
2018-03-08 10:19:17,Presided over the Kenya Prisons Service recruits pass-out parade at Prisons Staff Training College in Ruiru. https://t.co/fFCOAJu6xe,316,74,Twitter Web Client,971691817359101953
2018-03-07 14:41:24,"French firms set to invest more than $10b after Kenya visit
 https://t.co/HI78glsz1u https://t.co/OfVidlL57C",689,156,Twitter Web Client,971395394067468288
2018-03-07 13:00:38,"Brazil pledges to step up partnership with Kenya in cotton production
 https://t.co/Q2XpkLcwTu https://t.co/gkWrnytkIy",351,81,Twitter Web Client,971370034814701569
2018-03-07 11:37:52,With the outgoing Ambassador of the Republic of Mozambique to Kenya Daniel Antonio and the outgoing Ambassador of t… https://t.co/0IS6gGsToJ,341,63,Twitter Web Client,971349206169542657
2018-03-06 14:49:07,"The execution agenda includes a pilot for 100% access to universal healthcare in 4 counties, a programme supported… https://t.co/uWPv9cicoN",348,93,Twitter Web Client,971034950999920643
2018-03-06 14:45:43,"Met Governors and discussed implementation of universal healthcare for all, a key plank of my Big Four agenda… https://t.co/ubGH18Gi8J",378,69,Twitter Web Client,971034094040731649
2018-03-06 14:41:59,The opening of the Africa-France Business Forum and the launch of Stars in Africa EU-Africa Youth and Entrepreneurs… https://t.co/Hvftsdfebu,110,37,Twitter Web Client,971033152750850048
2018-03-06 11:08:06,"Big Four agenda’s massive opportunities for local and global private sector, says President Kenyatta https://t.co/poRw9O6wO5",334,106,Twitter Web Client,970979329164365824
2018-03-06 08:55:20,And they are thriving because Africa is changing. Africa is marching away from a narrative of helplessness to that… https://t.co/9s38I3NeSB,1214,236,Twitter Web Client,970945915828817920
2018-03-06 08:53:41,"This is a great time to invest and to prosper in Africa. Today’s venue, iHub, is home to young innovators and entre… https://t.co/nGdOCjDYrW",405,144,Twitter Web Client,970945500861157381
2018-03-06 08:52:13,"During the France-Africa Business Forum at iHub, where Mr. Pierre Gattaz, President of the Enterprise Movement of F… https://t.co/UJpUfYf5D0",292,105,Twitter Web Client,970945132957786113
2018-03-04 11:11:54,"As citizens of this great Nation, we must  recognize that we are indeed our brother’s keeper. If we look out for on… https://t.co/lFadIW7PXP",1423,264,Twitter Web Client,970255510074220544
2018-03-04 11:10:51,Joined Christian faithfuls for a Sunday Service at Ridgeways Baptist  Church. As the Good Book reminds us; let’s ca… https://t.co/6Qt2bnf8QR,574,112,Twitter Web Client,970255246655213568
2018-03-03 17:08:41,President Kenyatta calls on Kenyans to emulate visionary leaders https://t.co/FPeRvLWj49 https://t.co/R6kd7S4TQL,450,86,Twitter Web Client,969982906750955520
2018-03-03 13:59:59,Mzee Mwangangi was a great Kenyan who had a clear vision not only for his family but also for the entire country. I… https://t.co/h6H9ZzRLzK,392,83,Twitter Web Client,969935421324124160
2018-03-03 13:58:21,Attended the burial ceremony for the late Raphael Mwangangi Waita in Machakos. Mzee Mwangangi was the father to… https://t.co/aHeIXbJjN6,339,74,Twitter Web Client,969935010861080580
2018-03-03 08:09:20,President Kenyatta mourns Justice Onguto https://t.co/Skl9o1iA4v,312,65,Twitter Web Client,969847178045874176
2018-03-02 13:58:12,"Cabinet Secretaries, Chief Administrative Secretaries and Principal Secretaries sign two oaths that bind them to hi… https://t.co/edpzqyndEL",336,56,Twitter Web Client,969572584802193409
2018-03-02 11:20:46,"My Government promises to give each and every Kenyan better services and a secure platform upon which, through the… https://t.co/dfQnLASoK5",839,171,Twitter Web Client,969532964475465728
2018-03-02 11:20:02,"Their appointment to the Govt. is a call to service with honour &amp; integrity, to servant leadership, to sacrifice, t… https://t.co/ESKSNFLGU9",278,82,Twitter Web Client,969532778197999622
2018-03-02 11:18:39,"At the commencement of my second term of office, I promised Kenyans a difference in the manner of delivery of publi… https://t.co/eBsJcnRVPV",2047,393,Twitter Web Client,969532429957464064
2018-03-02 11:17:33,"Having taken their oath of office, my expectation is that they will immediately embark on providing citizens of thi… https://t.co/XRsUShMxv7",333,88,Twitter Web Client,969532157122277376
2018-03-02 11:16:33,"Witnessed the swearing-in of Chief Administrative Secretaries and Principal Secretaries at State House, Nairobi. https://t.co/hQJFYR6ahK",418,116,Twitter Web Client,969531902095962112
2018-03-01 09:42:22,Held talks with Africa50 CEO Alain Ebobissé at State House. Our discussions focused on support for Kenya's infrastr… https://t.co/bl0Y4NA8NB,575,111,Twitter Web Client,969145811652227072
2018-02-28 14:10:01,"Met His Royal Highness, Prince Salman Bin Hamad Al-Khalifa, the Crown Prince of the Kingdom of Bahrain and discusse… https://t.co/Z7chxqSqLC",482,99,Twitter Web Client,968850782807379968
2018-02-28 12:45:47,"As we mourn and pay homage to this visionary leader, let us also celebrate his life and achievements. Although Mzee… https://t.co/MGk2L2xl5t",354,60,Twitter Web Client,968829585554051073
2018-02-28 12:45:10,We will fondly remember Mzee M’Murwithania alongside other icons of the  freedom struggle who were ready to lay dow… https://t.co/rpl8FZqipl,185,35,Twitter Web Client,968829430872322050
2018-02-28 12:44:04,It is with grief and a deep sense of loss that I learnt of the death of Mzee M’Murwithania. I convey my deepest sym… https://t.co/C5f5D4Mndk,262,58,Twitter Web Client,968829152215355392
2018-02-28 12:36:21,"No room for pilferage and wastage, President Kenyatta warns government officials https://t.co/QSzvSWpK3i https://t.co/Rx1vvo9xOK",417,124,Twitter Web Client,968827208226824193
2018-02-27 11:31:54,Technology will be major driver for Big Four plan https://t.co/BN31TzFy0o,224,72,Twitter for iPad,968448603495821314
2018-02-27 11:22:21,It cannot be overemphasized that greater collaboration between the public and private sectors is a must.  The two s… https://t.co/gusKDHmlHJ,163,38,Twitter for iPad,968446198184140800
2018-02-27 11:21:11,"KONZA will lead to the creation of at least 17,000 high-skilled jobs by the end of Phase 1. This is one area that w… https://t.co/LxEiGqk3fl",275,71,Twitter for iPad,968445905291612160
2018-02-27 11:21:05,"We are moving towards fully servicing access roads, water, and electricity, with sufficient capacity and reliabilit… https://t.co/2hAO3Ir1D9",144,35,Twitter for iPad,968445881770012672
2018-02-27 11:20:26,The vision behind Konza Technology City is a sustainable world-class technology hub and a major economic driver for… https://t.co/xOG3yLebTd,244,72,Twitter for iPad,968445716434685954
2018-02-27 11:19:41,"Excited about our Presidential Digital Talent Programme, which has the support of several Companies. To date, has p… https://t.co/bwuN9nPpdN",203,56,Twitter for iPad,968445528458526720
2018-02-27 11:15:39,"We embarked on the Konza Techno-city, and heavily invested in the Ajira Digital Programme and the National Optic Fi… https://t.co/ASOJXEJf0o",167,45,Twitter for iPad,968444514556932096
2018-02-27 11:15:09,We are expanding Kenya’s digital frontier by spearheading major ICT investments including the digital literacy prog… https://t.co/rBCfGwbq6e,177,58,Twitter for iPad,968444385858936832
2018-02-27 11:11:58,"To achieve the ambitious goals that we have laid out, we must optimise connectivity and Internet access, ensuring t… https://t.co/x8MIWUcjVQ",221,57,Twitter for iPad,968443585447292928
2018-02-27 11:11:42,I outlined my Big Four plan for growing our economy and ensuring that growth makes a difference to the lives of our… https://t.co/IMv5W56dUh,152,45,Twitter for iPad,968443519688900608
2018-02-27 11:10:24,Jobs are a big focus.  Facilitating the growth of a digital economy is an important pillar to realize our vision to… https://t.co/7enHpjVnBh,700,132,Twitter for iPad,968443191367208961
2018-02-27 11:01:08,"The future of technology and innovation in this country, and the means by which to give an opportunity to our young… https://t.co/r7iXvuKzUC",255,89,Twitter for iPad,968440862081454080
2018-02-27 11:00:24,Attended a symposium on the theme “Digital Drivers: Enabling the Growth of Africa's Digital Economy” at Strathmore… https://t.co/mFPhWomC3s,163,44,Twitter for iPad,968440673950142465
2018-02-27 10:31:51,"Held talks with Jean Todt, President of the Federation Internationale de l'Automobile (FIA) who called on me at Sta… https://t.co/nXj0TTxUn6",152,43,Twitter for iPad,968433489992396801
2018-02-27 10:31:08,Assured skaters who also attended the flag presentation ceremony that they would be provided with space for their u… https://t.co/HDFfNO2tJz,228,43,Twitter for iPad,968433311646445568
2018-02-27 10:18:38,Congratulated the team and wished them success as they prepare to travel for the tournament. Urged the Ministries o… https://t.co/bnz6TtT5Wy,400,78,Twitter for iPad,968430164681076741
2018-02-27 09:57:21,Handed over the National Flag to the Junior Golf Foundation team that will participate in the All Africa Golf Junio… https://t.co/I52XzeODUO,275,50,Twitter for iPad,968424806851993600
2018-02-26 16:44:47,"President Kenyatta receives FIFA World Cup Trophy, pledges commitment to nurture local talents… https://t.co/kfnBifIbdN",1055,269,Twitter Web Client,968164956435861505
2018-02-26 15:53:31,Received the FIFA World Cup trophy which is on a global tour ahead of this year’s tournament set to kick off in Jun… https://t.co/RJDX01ddXR,1772,461,Twitter Web Client,968152053800456197
2018-02-26 15:08:49,"With senior Finance and Industry experts including Dr. Mukhisa Kituyi, Secretary General of United Nations Conferen… https://t.co/xXuaVIeaLu",778,176,Twitter Web Client,968140805889298432
2018-02-25 16:22:37,"As we mourn and pay homage to this visionary leader, let us also celebrate his life and achievements. Mzee Waita’s… https://t.co/qT9AFCAmqL",205,36,Twitter Web Client,967796986383618050
2018-02-25 16:22:01,Among his achievements included the localization of the energy sector where he was instrumental in driving policy c… https://t.co/efLscNwkpH,125,26,Twitter Web Client,967796837678755840
2018-02-25 16:21:24,"Mzee Waita’s career at Caltex Oil Kenya spanned 29 years, where he held several senior positions, ultimately becomi… https://t.co/a07nJNVBAf",116,31,Twitter Web Client,967796684192468992
2018-02-25 16:20:53,"He was focused and hardworking, a trait that made him to be headhunted by Caltex Petroleum Corporation in New York… https://t.co/SnKQUzRTPK",127,21,Twitter Web Client,967796551706914816
2018-02-25 16:20:12,He was a great Kenyan who had a clear vision for the growth &amp; development of local management expertise.Mzee’s patr… https://t.co/1AKLHvkN80,111,25,Twitter Web Client,967796379023179777
2018-02-25 16:17:39,It is with grief and a deep sense of loss that I learnt of the death of Mzee Raphael Mwangangi Waita and I convey m… https://t.co/3QSQEkwGjr,470,98,Twitter Web Client,967795737387065344
2018-02-25 10:10:07,Hongera @DicksonChumba3 on winning the 2018 Men's #TokyoMarathon and for reaffirming #MagicalKenya's place in the g… https://t.co/yEjdFzBq4M,595,164,Twitter for Android,967703246381993986
2018-02-24 14:04:46,RT @MEsipisu: President @KagutaMuseveni proposes radar and tech surveillance of Lake Victoria to grow fish volumes and end disputes amongst…,0,71,Twitter Web Client,967399911498113025
2018-02-24 13:59:54,East Africa must integrate for economic strength https://t.co/P3Gl96IXVw https://t.co/IHZFwwmTUp,455,114,Twitter Web Client,967398684274118661
2018-02-24 11:18:28,Together with President @KagutaMuseveni of Uganda when we commissioned the Busia One Stop Border Post in Busia town… https://t.co/hzMErTYyOZ,1263,398,Twitter Web Client,967358060502151168
2018-02-24 10:12:08,On arrival in Busia town to commission the Busia One Stop Border Post along the common border of Uganda and Kenya. https://t.co/CGFfTIVx8N,1166,271,Twitter Web Client,967341366345904128
2018-02-24 10:09:44,RT @MEsipisu: Presidents @UKenyatta and @KagutaMuseveni have formally opened the One-Stop border post in Busia town. It will ease the movem…,0,123,Twitter Web Client,967340760260595713
2018-02-24 08:45:57,RT @MEsipisu: President @UKenyatta to open one-stop border post in Busia https://t.co/Ig6IaFnceb https://t.co/J3NqawvUxe,0,79,Twitter Web Client,967319676006141953
2018-02-24 08:36:34,"Departing from Uganda where I held successful deliberations with other East African Community Heads of State, durin… https://t.co/Bu2Lp4Mlbx",689,138,Twitter Web Client,967317316731133952
2018-02-23 16:49:58,"Also made a strong pitch for faster movement of goods and services, and called on East Africans to do everything to… https://t.co/etkJryoKzE",290,85,Twitter Web Client,967079094969163776
2018-02-23 16:48:36,"“Variable geometry” allows countries committed to specific agreements to do so, while those not ready or have their… https://t.co/bmaX6ZXg7I",422,109,Twitter Web Client,967078753007489025
2018-02-23 16:48:05,EAC leaders agree to explore “variable geometry” in trade with the EU https://t.co/PCkc1Du24o https://t.co/0ESM1iNsbu,200,68,Twitter Web Client,967078622258491394
2018-02-23 15:53:20,Met President Salva Kiir of South Sudan on the sidelines of the 19th Ordinary Summit of East African Community Head… https://t.co/2fN7XNeYc6,289,70,Twitter Web Client,967064844154306561
2018-02-23 15:19:21,The East African Court of Justice was established under Article 9 of the Treaty for the Establishment of the EAC. I… https://t.co/qEioRbd3gO,371,92,Twitter Web Client,967056291008040960
2018-02-23 15:17:31,Lawyer Charles Nyachae sworn in as judge of East African Court of Justice https://t.co/nJsHlF140X https://t.co/KKzEAUOCmu,845,248,Twitter Web Client,967055828229525505
2018-02-23 09:34:20,"Presidents Kenyatta, Magufuli direct ministers to resolve small, vexing differences  https://t.co/8gxUM31dFB https://t.co/TWX6g8LCxB",414,124,Twitter Web Client,966969466398691328
2018-02-23 07:19:48,Held a meeting with Tanzanian President John Magufuli on the sidelines of the 19th Ordinary Summit of East African… https://t.co/kSgJQ5DOEA,1278,257,Twitter for Android,966935606927470592
2018-02-22 14:16:11,In Kenya significant progress has been made in infrastructural development through Public-Private Partnerships (PPP… https://t.co/JxSuHbb40o,763,182,Twitter Web Client,966678007816638464
2018-02-22 14:13:17,Called on regional leadership to work closely in ensuring that bureaucratic red tape does not impede development ta… https://t.co/l7fILSelVF,271,88,Twitter Web Client,966677276426407936
2018-02-22 13:29:25,President Museveni praises Kenya for SGR progress https://t.co/Y32YFOwPQp https://t.co/LcXsJlf95g,738,190,Twitter Web Client,966666237244821504
2018-02-22 11:42:05,"My administration shall ensure the prudent, transparent and efficient utilization and management of these funds for… https://t.co/WUpP2sJVeo",442,142,Twitter Web Client,966639225855758337
2018-02-22 11:41:12,Pleased by the report from CS @HKRotich that we have successfully priced a new $2 billion Eurobond issue at the Lon… https://t.co/DeUk2QswuU,1226,477,Twitter Web Client,966639006099353605
2018-02-22 10:06:40,During the joint East African Community Heads of State retreat on infrastructure and health financing and developme… https://t.co/eH30eKLVag,546,152,Twitter Web Client,966615212647485440
2018-02-22 07:14:46,Arrived in Kampala for the EAC Summit and the presidential retreat aimed at accelerating attainment of EAC developm… https://t.co/L5uBID2HIx,713,176,Twitter Web Client,966571954609287170
2018-02-22 05:36:17,Departed for a three-day official visit to Uganda to attend a presidential retreat on financing infrastructure and… https://t.co/ss5iZ8wU8f,1504,284,Twitter Web Client,966547168466268160
2018-02-21 15:44:36,"As he goes home to the rest prepared for God's faithful servants, our thoughts and prayers are with his family and… https://t.co/Fn0ll4eNB4",805,160,Twitter for Android,966337868007399424
2018-02-21 15:44:26,We in Kenya were fortunate to host him twice: in 1960 and in 1976. His words won many hearts; and the ministries wh… https://t.co/ryn91qGHah,345,81,Twitter for Android,966337828811665408
2018-02-21 15:44:01,That sincerity and simplicity made him one of the most inspirational preachers of the Gospel there has ever been.,315,79,Twitter for Android,966337721231925248
2018-02-21 15:43:44,"For decades, in season and out of season, he preached the gospel with a persistence and a humility that was taken t… https://t.co/0IoAi4lRKF",441,120,Twitter for Android,966337650880864257
2018-02-21 15:43:09,The Great Commission is as simple as it is clear: “Go therefore and make disciples of all nations”. Few men in hist… https://t.co/qv7lpsdX84,1773,518,Twitter for Android,966337505560858624
2018-02-21 13:54:42,RT @MEsipisu: The President will also speak on Economic Partnership Agreements (EPAs) arrangements between the EAC and the EU. President @U…,0,51,Twitter Web Client,966310214206214144
2018-02-21 13:54:21,"RT @MEsipisu: The President sees enhanced people-to-people contact as key to improving trade, growing regional economies and lifting the li…",0,18,Twitter Web Client,966310126041878528
2018-02-21 13:54:16,"RT @MEsipisu: President @UKenyatta will urge greater speed in implementing projects, with a sharp focus on continuing the agenda of promoti…",0,21,Twitter Web Client,966310105129070592
2018-02-21 13:54:12,RT @MEsipisu: The President will make the point that it was no longer viable for East Africa to build infrastructure with a silo-mentality.,0,19,Twitter Web Client,966310088771334144
2018-02-21 13:54:09,"RT @MEsipisu: President @UKenyatta will showcase the progress Kenya has made in investments in infrastructure over the last five years, unv…",0,29,Twitter Web Client,966310073667645441
2018-02-21 13:54:05,"RT @MEsipisu: On Thursday, leaders will hold the retreat on financing infrastructure and health, before attending the EAC summit on Friday.…",0,37,Twitter Web Client,966310058253578241
2018-02-21 13:54:02,"RT @MEsipisu: Affordable health for all is one of President @UKenyatta Big Four commitments in his second term, alongside affordable housin…",0,31,Twitter Web Client,966310043682471936
2018-02-21 13:53:58,RT @MEsipisu: President @UKenyatta will start a three-day official visit to Uganda on Thursday to attend a presidential retreat on financin…,0,97,Twitter Web Client,966310027257700352
2018-02-16 13:39:29,"President directs @NYS_Ke to commercialise, play key role in industrialisation
  https://t.co/QCp9JvM8G3",247,58,Twitter Web Client,964494445239513089
2018-02-16 13:33:21,Swearing-in of Cabinet Secretaries at State House. https://t.co/WR3jBg1ndO,667,147,Twitter Web Client,964492899344936960
2018-02-16 13:14:54,Speech during the National Youth Service Recruits Pass-Out parade at the NYS College in Gilgil.  https://t.co/yn69aueq5k,237,54,Twitter Web Client,964488257789747200
2018-02-16 12:59:59,"In this regard, I direct the Service to expedite its commercialization agenda, especially in the areas of agribusin… https://t.co/gSET3ozGbh",355,84,Twitter Web Client,964484502264393733
2018-02-16 12:58:26,"In the Big Four, it has found them. The pillars of the Big Four are held up by our youth: in every area of endeavou… https://t.co/3deOrS88Wf",592,136,Twitter Web Client,964484112332541952
2018-02-16 12:56:48,The focus of my Government for the next five years is what we have called the Big 4 Agenda. These are: manufacturin… https://t.co/kqGjRNW0UN,512,113,Twitter Web Client,964483703429836800
2018-02-16 12:54:21,"Presided over the Passing-Out Parade of the National Youth Service Recruits at the NYS College, Gilgil. https://t.co/dwUHp2kfNq",513,100,Twitter Web Client,964483083998302208
2018-02-16 10:10:41,"My Government promises to give each and every Kenyan better services and a secure platform upon which, through the… https://t.co/8UwbZa5c8y",513,134,Twitter Web Client,964441897858224128
2018-02-16 10:09:27,"I look towards my Cabinet for selfless service, unimpeachable integrity, dedication to duty and unmatched excellenc… https://t.co/yeb8RDZRV9",1087,248,Twitter Web Client,964441587915935745
2018-02-16 09:15:18,During the swearing-in of Cabinet Secretaries at State House. https://t.co/Oa63zrPFlf,1555,308,Twitter Web Client,964427959535788033
2018-02-15 13:00:31,We congratulate @CyrilRamaphosa for being elected the 5th Democratic President of the Republic of South Africa. We… https://t.co/hyMAJwMEV0,4653,1301,Twitter for Android,964122250826997760
2018-02-14 14:42:21,Joined other Christians in ushering in  the start of Lent by attending the Ash Wednesday Mass at the Holy Family Ba… https://t.co/D8gxlVOWJt,1787,372,Twitter Web Client,963785487210213378
2018-02-14 09:32:29,Met Senators from the Jubilee Party. Emphasized the need for Senators to play their oversight role effectively to e… https://t.co/M4w4VvbSlC,1220,272,Twitter Web Client,963707507557523456
2018-02-13 12:54:54,Statement on the resignation of Attorney General https://t.co/VRBkStEgj5 https://t.co/SmmhX2e4Ed,810,277,Twitter Web Client,963396059509739520
2018-02-13 12:32:53,Nominated Judge Paul Kihara Kariuki as Attorney General. https://t.co/i7R1WM53ML,567,220,Twitter Web Client,963390518838398976
2018-02-13 11:55:13,I have also nominated Abdikadir Mohammed as Ambassador to South Korea.,664,221,Twitter Web Client,963381040885747712
2018-02-13 11:53:56,I have also today nominated Kennedy Ogeto as Solicitor General and appointed Njee Muturi as Deputy Chief of Staff.,665,278,Twitter Web Client,963380715894263810
2018-02-13 11:51:01,I have received with regret the resignation of Attorney General Prof. Githu Muigai. I thank him for his service for… https://t.co/wppL6pmjY4,4477,2033,Twitter Web Client,963379983124193281
2018-02-13 11:21:22,We need to pass laws that will enable us to achieve the agenda that will transform the lives of Kenyans. Time is li… https://t.co/uiKYeP2fXq,670,152,Twitter Web Client,963372522556329984
