created_at,text,favorite_count,retweet_count,source,id
2017-10-14 12:13:09,#KiambuNiJubilee #WembeNiUleUle #MunguNiYuleYule #WakenyaNiWaleWale https://t.co/DJmnUChy21,390,88,Twitter Web Client,919174233435099137
2017-10-14 11:06:49,#WembeNiUleUle #MunguNiYuleYule #WakenyaNiWaleWale https://t.co/I6dkbAKrz9,425,117,Twitter Web Client,919157538918207489
2017-10-14 11:01:26,Only Kenyans will decide who leads this nation on October 26 through the ballot #WembeNiUleUle #MunguNiYuleYule… https://t.co/p2oZUimnUA,714,213,Twitter Web Client,919156185370124289
2017-10-14 10:59:27,"We are not interested in mediation,we have our constitution that clearly states the President of our Republic shall… https://t.co/GqOrhjFsbG",1001,338,Twitter Web Client,919155687141371904
2017-10-14 10:56:38,Meeting residents of Kenol on our meet-the-people tour of Murang’a County #WembeNiUleUle #MunguNiYuleYule… https://t.co/k81Um5MDDO,449,114,Twitter Web Client,919154978828308480
2017-10-14 09:11:44,Ordered police to pursue the killers and bring them to justice.,751,134,Twitter Web Client,919128579572715527
2017-10-14 09:11:26,My thoughts and prayers are with their families at this time of sorrow and grief. I also pray for a quick recovery of those injured.,509,92,Twitter Web Client,919128502607245312
2017-10-14 09:10:31,Deeply saddened by the death of young innocent lives lost at Lokichogio Secondary school in Turkana County.,1507,341,Twitter Web Client,919128272277000192
2017-10-14 08:28:35,#WembeNiUleUle https://t.co/dAPBNcterL,397,112,Twitter for Android,919117720666476544
2017-10-14 03:23:21,Tuko Pamoja! https://t.co/qZyQpiFgJC,964,193,Twitter for Android,919040904161308672
2017-10-13 17:40:38,Congratulations to #MalkiaStrikers for qualifying for #FIVBWorldVolleyballChampionships. 3-0 beating of Egypt well deserved. Well done.,1351,374,Twitter for Android,918894258354089986
2017-10-13 17:39:49,"On PM live on SAfm, Spokesperson on Kenya elections https://t.co/N2R5F0iyeX",173,33,Twitter Web Client,918894052833185793
2017-10-13 16:05:49,"RT @MEsipisu: On Monday, 23 October 2017, the President will campaign in Nairobi.",0,61,Twitter Web Client,918870398716039169
2017-10-13 16:05:46,"RT @MEsipisu: On Sunday, 22 October 2017, the President will attend a National Prayer event.",0,35,Twitter Web Client,918870384711294976
2017-10-13 16:05:42,"RT @MEsipisu: On Saturday, the President will visit Mau (Narok County) and Kajiado.",0,34,Twitter Web Client,918870368466718720
2017-10-13 16:05:33,"RT @MEsipisu: On Friday, he will return to Nairobi for Mashujaa Day celebrations at Uhuru Park grounds, and later host a luncheon at State…",0,38,Twitter Web Client,918870332592787457
2017-10-13 16:05:30,"RT @MEsipisu: On Thursday, the President will visit Kitale (Trans Nzoia County), Vihiga and Nandi counties.",0,28,Twitter Web Client,918870320207007744
2017-10-13 16:05:25,"RT @MEsipisu: ...and transformation agenda that will guarantee a free, equitable, stable, inclusive and prosperous Kenya.",0,21,Twitter Web Client,918870297662631939
2017-10-13 16:05:21,"RT @MEsipisu: On Wednesday, the President heads to Kuria (Migori County), Kisii and Kericho where he will reiterate his message and vision…",0,45,Twitter Web Client,918870283238494208
2017-10-13 16:05:17,"RT @MEsipisu: On Tuesday, the Head of State takes the campaigns for his re-election to Samburu, Nanyuki (Laikipia County) and Nakuru.",0,41,Twitter Web Client,918870262803849216
2017-10-13 16:05:12,"RT @MEsipisu: On Monday, 16 October 2017, President Kenyatta will visit Garissa, Mwingi (Kitui County) and Machakos County.",0,65,Twitter Web Client,918870244957020160
2017-10-13 16:05:09,RT @MEsipisu: Tomorrow the President will hold a rally at Kenol in Murang’a County before he proceeds to Ndumberi grounds in his home count…,0,49,Twitter Web Client,918870232319610880
2017-10-13 16:05:06,"RT @MEsipisu: ""They already showed this trust and confidence in August when we believe they voted overwhelmingly for us.”",0,27,Twitter Web Client,918870219426357249
2017-10-13 16:05:03,"RT @MEsipisu: “This is about taking my policies to the people of Kenya allowing them to reconfirm their confidence in me.""",0,29,Twitter Web Client,918870205127970816
2017-10-13 16:04:59,"RT @MEsipisu: Ahead of the nine-day campaign blitz, the President said....",0,21,Twitter Web Client,918870191043502080
2017-10-13 16:04:53,RT @MEsipisu: The October 26 fresh elections were ordered by the Supreme after it nullified the August 8 poll.,0,29,Twitter Web Client,918870165479133184
2017-10-13 16:04:50,"RT @MEsipisu: He will speak to the need for peace before, during, and after elections.",0,28,Twitter Web Client,918870151747002368
2017-10-13 16:04:46,RT @MEsipisu: President @UKenyatta will take his agenda of unifying the country and economic transformation directly to the people.,0,54,Twitter Web Client,918870135317942272
2017-10-13 16:04:42,RT @MEsipisu: ...interrupting his campaign only with a dash to the capital for Mashujaa Day celebrations on October 20.,0,23,Twitter Web Client,918870118913978369
2017-10-13 16:04:36,RT @MEsipisu: President @UKenyatta will tomorrow start a meet-the-people tour that will take him to 17 counties ahead of fresh elections on…,0,104,Twitter Web Client,918870094624804865
2017-10-13 15:21:33,https://t.co/xPcot92QuD,88,27,Twitter Web Client,918859257788936192
2017-10-13 11:48:50,"As Jubilee, we are committed to an inclusive and equitable society where no Kenyan is left behind. https://t.co/xSCuBMLZhY",910,180,Twitter Web Client,918805727724044288
2017-10-13 11:10:08,"Meeting a delegation of leaders of the National People with Disabilities (NPWD) at State House, Nairobi. https://t.co/Sz7liRQZop",461,117,Twitter Web Client,918795989531623424
2017-10-13 10:57:38,"RT @MEsipisu: President Kenyatta receives election amendment bill from Parliament, has 14 days to consider: https://t.co/FvkFxspvLy",0,78,Twitter Web Client,918792840511197184
2017-10-13 09:47:40,RT @MEsipisu: President Kenyatta signs into law Supplementary budget bill: https://t.co/kClhGcjMdD,0,68,Twitter Web Client,918775235125620737
2017-10-13 09:43:39,"The Supplementary Appropriation (No. 3) Act, 2017, also allocates Kshs 6.7 billion for maize subsidy.",403,96,Twitter Web Client,918774224701018112
2017-10-13 09:34:01,Signed into law the Supplementary budget that allocates Kshs 12 billion for Oct 26 fresh poll &amp; Kshs 25 billion for… https://t.co/cWTe62XCDY,1872,622,Twitter Web Client,918771799160229888
2017-10-13 05:30:35,Tuko Pamoja! https://t.co/3jKxTjRBqd,1175,225,Twitter for Android,918710538321793025
2017-10-12 13:28:17,"Also welcomed Kajiado opposition leaders Daniel Tinaayai, Joseph Simel &amp; Samuel Moinket who pledged their support i… https://t.co/dNc6t0H8Du",931,209,Twitter for iPad,918468365605359617
2017-10-12 13:26:06,Received former Kajiado Governor David Nkedianye in Jubilee Party. https://t.co/Vdeq4SOlGz,1450,273,Twitter for iPad,918467818450051074
2017-10-12 08:24:23,Tuko Pamoja! https://t.co/8V01VZFCpM,1514,326,Twitter for Android,918391888335470592
2017-10-11 11:10:42,"Deeply saddened by the death of Mzee Josephat Mwatia, father of gospel artists Rufftone and Daddy Owen. May God comfort the grieving family.",2877,641,Twitter Web Client,918071353084964864
2017-10-11 07:29:36,Tuko Pamoja! https://t.co/jzyhcFrGYv,1466,321,Twitter for Android,918015711045398528
2017-10-10 15:51:41,Democracy is for all and no single individual can stand in the way of the democratic right of the people… https://t.co/RdJvKUGgvD,1109,360,Twitter Web Client,917779678575955968
2017-10-10 15:49:25,What is the justice in the act of withdrawing from an election after causing Kenyans to use Kenya shillings 12 bill… https://t.co/vFrfEOmXBl,1913,690,Twitter Web Client,917779108372901891
2017-10-10 15:42:48,We don’t have time for empty rhetoric and divisive politics. Our agenda is to fulfill our promises to the Kenyan pe… https://t.co/fo4oLf47fn,696,190,Twitter Web Client,917777443737493504
2017-10-10 14:29:54,We shall not relent in our efforts to ensure we have transformed our nation. https://t.co/GQilFZPpuC,657,163,Twitter Web Client,917759097805697024
2017-10-10 14:27:09,Thanked the residents of Kilifi for their votes in the August 8 polls. Our priority as Jubilee is development for i… https://t.co/ZouHFIKWHG,489,111,Twitter Web Client,917758404843786240
2017-10-10 14:24:53,#KilifiNiJubilee #WembeNiUleUle #MunguNiYuleYule #WakenyaNiWaleWale https://t.co/kmXuI02LnU,502,124,Twitter Web Client,917757832698695680
2017-10-10 12:41:17,"RT @MEsipisu: President, DP Ruto voice strong support for electoral law changes: https://t.co/9BtSJRg8hy https://t.co/ykucXn2RE1",0,57,Twitter Web Client,917731763983716352
2017-10-10 12:20:13,"I will not hesitate, even for a minute, to sign the new amendments into law once presented to me after debate and a… https://t.co/BTESm5wVIk",1817,597,Twitter Web Client,917726462718902272
2017-10-10 12:18:22,"To lay a foundation for free, fair, transparent and credible elections, we need broad support for these amendments… https://t.co/8il9oU6wD2",285,78,Twitter Web Client,917725997054775299
2017-10-10 12:16:31,Voiced strong support for amendments to electoral laws to fill the gaps identified by the Supreme Court when it ann… https://t.co/7TlTQmnsiL,285,73,Twitter Web Client,917725530518097920
2017-10-10 12:13:39,"Meeting Jubilee leaders from Mombasa at State House, Mombasa #WembeNiUleUle #MunguNiYuleYule #WakenyaNiWaleWale https://t.co/5RnstURXut",244,60,Twitter Web Client,917724810511355904
2017-10-10 04:39:11,Tukutane Voi na Kaloleni! https://t.co/bvEPyu8YBL,461,92,Twitter for Android,917610437172178945
2017-10-10 04:06:09,Tuko Pamoja! https://t.co/6jfP2jHZem,632,114,Twitter for Android,917602126444064768
2017-10-09 16:11:28,https://t.co/KigD6GVRBO,122,22,Twitter Web Client,917422268342513665
2017-10-09 16:06:17,"Only pay services offered to you, President tells Kongowea traders https://t.co/xq7KdxctCP https://t.co/iYjZR4hUBq",388,97,Twitter Web Client,917420963352006656
2017-10-09 15:31:28,"With six-year-old Omar Mohamed whom I invited to State House, Mombasa. https://t.co/0c7IkdSQ19",1352,338,Twitter Web Client,917412202507853830
2017-10-09 15:07:02,#MombasaNiJubilee #WembeNiUleUle #MunguNiYuleYule #WakenyaNiWaleWale https://t.co/B95JHwENSW,577,167,Twitter Web Client,917406054908092421
2017-10-09 12:48:42,RT @MEsipisu: President welcomes Raila’s plan to withdraw from election: https://t.co/s6zneuUUN6 https://t.co/DMU4jwmZWI,0,125,Twitter Web Client,917371242994438145
2017-10-09 12:33:55,"If our opponents are not interested in the fresh polls, they should step aside so that the country can move forward… https://t.co/fDbDWENyOM",883,259,Twitter Web Client,917367520411160576
2017-10-09 12:22:36,Kenyans are tired &amp; want to move forward #WakenyaNiWaleWale #WembeNiUleUle #DebeNiLileLile https://t.co/sB7qIw1xB1,488,119,Twitter Web Client,917364672822693888
2017-10-09 11:31:30,"Meeting a delegation of Coast region political leaders at Serani grounds, Mombasa #WakenyaNiWaleWale #WembeNiUleUle… https://t.co/igp5nkEYxi",547,153,Twitter Web Client,917351813304680448
2017-10-09 09:48:31,https://t.co/mAUioMlVNa,143,36,Twitter Web Client,917325898415607810
2017-10-09 06:06:55,Tuko Pamoja! https://t.co/FYSCYMzWRJ,1122,212,Twitter for Android,917270129297231872
2017-10-08 19:18:31,Today at Serani grounds in Mombasa #WembeNiUleUle https://t.co/UALM7hq1lx,257,67,Twitter Web Client,917106952668352514
2017-10-08 16:49:09,Congratulations to Brigid Kosgei on finishing second at the 2017 Chicago Marathon.,568,99,Twitter Web Client,917069365203390464
2017-10-08 16:48:48,Congratulations to Abel Kirui &amp; Bernard Kipyego on their efforts at the 2017 Chicago Marathon where they finished 2nd and 3rd respectively.,696,142,Twitter Web Client,917069277101993987
2017-10-08 15:14:07,Hassan Omar declares his support https://t.co/MolmTaIVDm https://t.co/2DnL9U09Ur,648,163,Twitter Web Client,917045448371851264
2017-10-08 15:00:59,…..and those whose intent is to serve Kenyans and transform our people’s lives #WakenyaNiWaleWale #WembeNiUleUle… https://t.co/YvB2e6k165,405,78,Twitter Web Client,917042141515468801
2017-10-08 14:59:00,A time has come in our nation when we need to differentiate between leaders who seek leadership for the sake of gai… https://t.co/AFLtffrwDn,608,150,Twitter Web Client,917041643156590592
2017-10-08 14:33:16,It pleases me to welcome former Wiper Party Secretary General Hassan Omar in Jubilee #WembeNiUleUle https://t.co/W2dBOj20bR,1131,364,Twitter Web Client,917035170284425216
2017-10-08 13:21:20,"Meeting a 10,000 member delegation of Coast leaders at Serani grounds, Mombasa #WakenyaNiWaleWale #WembeNiUleUle… https://t.co/tqOjsSXsUz",589,162,Twitter Web Client,917017064707121152
2017-10-08 12:16:54,On arrival at Serani Grounds in Mombasa #WembeNiUleUle https://t.co/lKsx46mdbS,1236,353,Twitter Web Client,917000850819690496
2017-10-08 12:11:00,I urge Kenyans on Twitter and Facebook to honour them for their efforts by voting by following details in these posters. #MagicalKenya,566,181,Twitter Web Client,916999367168548864
2017-10-08 12:09:54,"Through their efforts, they have consistently and positively profiled #MagicalKenya across the world as a global at… https://t.co/Sem3Rz81W7",294,106,Twitter Web Client,916999087291068416
2017-10-08 12:09:21,I am proud of  Elijah Manangoi &amp; Hellen Obiri's nomination for the 2017 IAAF World Athlete of the Year Award in the… https://t.co/qCR8iW9P4C,384,170,Twitter Web Client,916998949784997888
2017-10-08 12:08:30,"RT @iaaforg: RT to vote @hellen_obiri as Female World Athlete of the Year 2017.
 
#AthleticsAwards voting closes at 12pm BST on 16th Octobe…",0,4590,Twitter Web Client,916998735162351619
2017-10-08 12:08:15,"RT @iaaforg: RT to vote @ManangoiElijah as Male World Athlete of the Year 2017.
 
#AthleticsAwards voting closes at 12pm BST on 16th Octobe…",0,91065,Twitter Web Client,916998671983628289
2017-10-08 04:51:29,Tukutane Mombasa! https://t.co/55UjU2xnpH,1267,256,Twitter Web Client,916888756556353536
2017-10-08 04:46:08,Tuko Pamoja! https://t.co/JoAv6TMTAH,551,138,Twitter Web Client,916887410935500800
2017-10-07 16:25:33,National prayer day for peace. https://t.co/AOyDrPHLoP,679,134,Twitter for Android,916701036894674949
2017-10-07 16:25:11,Power cannot be gained through incitement and violence https://t.co/hLypK5C96M https://t.co/n5jd5qpBhj,622,182,Twitter Web Client,916700944762638336
2017-10-07 16:12:07,We will not allow violence &amp; lawlessness under the guise of demonstrations to disrupt lives &amp; livelihoods of innoce… https://t.co/jSuG5pNBsr,1339,304,Twitter Web Client,916697658898739201
2017-10-07 15:53:20,#NyandaruaNiJubilee #WakenyaNiWaleWale #WembeNiUleUle https://t.co/t9tfYyWGa0,530,135,Twitter Web Client,916692929707761664
2017-10-07 14:10:48,Meeting residents of Subukia in Nakuru County #WakenyaNiWaleWale #WembeNiUleUle https://t.co/dPpQkVrWoL,566,116,Twitter Web Client,916667125867139073
2017-10-07 13:53:32,Kenya will remain peaceful before and after poll https://t.co/uIDqzkGLmw https://t.co/k1f9SOuvkA,711,179,Twitter Web Client,916662781566509057
2017-10-07 13:51:33,Joined christian faithful for peace prayers organised by the Kenya Conference of Catholic Bishops at the Village of… https://t.co/5hKi5PEUlS,575,158,Twitter Web Client,916662281517322241
2017-10-07 07:18:29,My remarks on Gikomba Market fire tragedy https://t.co/CRhvwUJXhR,198,44,Twitter Web Client,916563365715161090
2017-10-07 07:15:42,My Government’s commitment to the Miraa sector #MeruNiJubilee https://t.co/aryVmNE6DV,186,34,Twitter Web Client,916562663135686657
2017-10-07 07:14:44,#MeruNiJubilee #WembeNiUleUle https://t.co/5gA9rPmuDx,136,26,Twitter Web Client,916562420608438272
2017-10-07 02:46:22,"Tukutane Nakuru, Laikipia na Nyandarua. #WembeNiUleUle #WakenyaNiWaleWale https://t.co/dRaqa8kYdd",778,194,Twitter Web Client,916494882306437120
2017-10-07 02:45:59,Tuko Pamoja! https://t.co/NxsggOOpom,356,66,Twitter Web Client,916494787397726208
2017-10-06 17:31:33,Our meet-the-people tour of Meru-Laare #WembeNiUleUle https://t.co/FW7K6l64Wq,255,55,Twitter Web Client,916355257168551942
2017-10-06 16:10:05,"Stop destroying Kenya’s economy for your selfish gain, President Kenyatta tells Raila https://t.co/e9BUefgLUs https://t.co/IJ3HYxZTwr",928,300,Twitter Web Client,916334758505918465
2017-10-06 15:33:06,Called on the people of Meru to turnout in large numbers once again to ensure an even larger victory on October 26… https://t.co/EIRSmIoGJE,382,104,Twitter Web Client,916325452075151362
2017-10-06 15:26:11,"Also deeply saddened by demise of Mzee Fanuel E. Asienga, father of Vihiga politician Johnstone Asienga. We mourn a great community leader.",276,64,Twitter for Android,916323711028027397
2017-10-06 15:11:57,"Deeply saddened by the death of Mama Susan Wairimu Chege, mother of Murang’a Women Rep @SABINACHEGE. My God comfort the grieving family",662,158,Twitter for Android,916320126126968832
2017-10-06 14:54:23,#MeruNiJubilee #WakenyaNiWaleWale #WembeNiUleUle #DebeNiLileLile https://t.co/qlgzVA1oAu,503,138,Twitter Web Client,916315707842990080
2017-10-06 13:41:07,Meeting residents of Makutano in Meru #WembeNiUleUle https://t.co/wmv70wiKHU,448,118,Twitter Web Client,916297267941961728
2017-10-06 12:57:57,I reaffirm my pledge to finish the work started #WakenyaNiWaleWale #WembeNiUleUle #DebeNiLileLile https://t.co/w0fuzSxbjd,1075,255,Twitter Web Client,916286406695313408
2017-10-06 12:54:13,We are clear on what we want to achieve for Kenyans as Jubilee; a transformed and united country #WakenyaNiWaleWale… https://t.co/I1cC3IdvE4,508,162,Twitter Web Client,916285465636098050
2017-10-06 11:21:08,I urge Kenyans to remain united and reject attempts by the opposition to divide the country #MeruNiJubilee… https://t.co/fxlWGgeBWR,855,224,Twitter Web Client,916262041324867585
2017-10-06 11:01:16,#MauaNiJubilee #WembeNiUleUle #WakenyaNiWaleWale https://t.co/ynQl27wib8,527,162,Twitter for iPad,916257041446064129
2017-10-06 10:02:21,"Meeting residents of Laare, Meru County. #WembeNiUleUle #WakenyaNiWaleWale https://t.co/zbDKeyL9Sw",809,230,Twitter Web Client,916242214614859776
2017-10-06 01:31:38,"Tukutane Meru!
#WembeNiUleUle https://t.co/xDsyDbrNWp",427,100,Twitter Web Client,916113689404694528
2017-10-06 01:28:46,Tuko Pamoja! https://t.co/AYxO1kLLTj,251,63,Twitter Web Client,916112967518838784
2017-10-05 19:18:41,"My remarks in Ogembo, Kisii County.
 #WembeNiUleUle #WakenyaNiWaleWale https://t.co/PraJoezct6",464,107,Twitter Web Client,916019833610866689
2017-10-05 17:25:08,"My remarks in Ekerenyo, Nyamira County.
 #WembeNiUleUle #WakenyaNiWaleWale https://t.co/FF8vu6KFl6",648,149,Twitter Web Client,915991257050206208
2017-10-05 14:43:37,President Kenyatta thanks Gusii community for supporting him https://t.co/L8ypPUbPxX https://t.co/jC6NQPOD7F,521,126,Twitter Web Client,915950608540209152
2017-10-05 13:53:30,Urged the residents to turnout in large numbers once again to reconfirm their choice &amp; ensure we secure victory in… https://t.co/ExiaMJXSfq,551,143,Twitter Web Client,915937996490395649
2017-10-05 13:48:07,Thanked the people of Nyamira for their support in the August 8 polls. https://t.co/b3qP8D4Yvn,492,144,Twitter Web Client,915936642288046082
2017-10-05 13:39:24,Interacting with residents of Gesami in Nyamira County #WembeNiUleUle #WakenyaNiWaleWale https://t.co/3ZezvjSAlx,495,147,Twitter Web Client,915934449887477760
2017-10-05 12:52:50,#NyamiraNiJubilee  #WakenyaNiWaleWale #DebeNiLiIeLile #WembeNiUleUle https://t.co/k4jn61evRc,990,245,Twitter Web Client,915922728804286466
2017-10-05 12:25:56,#IkongeNiJubilee #WembeNiUleUle https://t.co/IPgN7ANOao,362,84,Twitter Web Client,915915958673342464
2017-10-05 11:12:54,"Reject the opposition’s false tribal narrative, President Kenyatta urges Kenyans
  https://t.co/HFgtQ2zHaE https://t.co/r6RrF9ZYxT",429,126,Twitter Web Client,915897580642594816
2017-10-05 11:10:59,Meeting residents of Marani in Kisii County #WembeNiUleUle #WakenyaNiWaleWale https://t.co/1V6FeGT9aZ,558,157,Twitter Web Client,915897096745754624
2017-10-05 11:02:38,Jubilee has an agenda that will positively change the lives of Kenyans &amp; allow us to make progress as a nation.… https://t.co/f8HoISwYcQ,663,192,Twitter Web Client,915894996850675712
2017-10-05 10:58:51,Urged the residents not to be misled by politics of deception propagated by the opposition and instead embrace the… https://t.co/epdRaRXqOs,449,127,Twitter Web Client,915894046853394437
2017-10-05 09:47:19,During our meet-the-people tour of Kisii County in Sameta. #KisiiNiJubilee #TukoPamoja https://t.co/0I8iZhMG07,1049,240,Twitter Web Client,915876042602053632
2017-10-05 06:17:15,Tuko Pamoja! https://t.co/h38fsjh3sh,942,193,Twitter Web Client,915823176613089280
2017-10-05 03:07:07,Tuko Pamoja! https://t.co/voXMhkkBRq,589,119,Twitter Web Client,915775330157252608
2017-10-04 15:56:12,RT @MEsipisu: ...given his unprecedented development track record that has lifted the lives of many residents.,0,25,Twitter for iPad,915606489871593472
2017-10-04 15:56:10,"RT @MEsipisu: Last week President Kenyatta visited Western counties of Busia, Bungoma &amp; Kakamega where he was assured of massive support in…",0,30,Twitter for iPad,915606477418717184
2017-10-04 15:56:08,"RT @MEsipisu: ...that will guarantee a free, equitable, stable, inclusive and prosperous Kenya.",0,22,Twitter for iPad,915606471227985920
2017-10-04 15:56:06,"RT @MEsipisu: During the tours, the President will reiterate his message and vision of unity and transformation agenda...",0,27,Twitter for iPad,915606463422312450
2017-10-04 15:56:03,"RT @MEsipisu: From Nyandarua, the President takes his re-election campaigns to the Coast region starting with a meet-the-people tour of Mom…",0,35,Twitter for iPad,915606450428407808
2017-10-04 15:56:02,RT @MEsipisu: He will on Saturday join other faithful for the Catholic Church’s national prayer day at the Subukia Shrine in Nyandarua Coun…,0,24,Twitter for iPad,915606444606738432
2017-10-04 15:55:59,"RT @MEsipisu: On Friday, President @UKenyatta returns to his stronghold of Meru.",0,33,Twitter for iPad,915606434401878016
2017-10-04 15:55:58,"RT @MEsipisu: ...President @UKenyatta garnered 106,894 votes (52.07% of the votes cast) in Nyamira while in Kisii he got 175,415 votes (43.…",0,113,Twitter for iPad,915606428332720128
2017-10-04 15:55:56,RT @MEsipisu: In the August 8 presidential polls that were annulled by the Supreme Court...,0,11,Twitter for iPad,915606422360068097
2017-10-04 15:55:55,RT @MEsipisu: The President will kick off his latest meet-the-people tour in Kisii and Nyamira counties tomorrow to broaden his support bas…,0,34,Twitter for iPad,915606414797819904
2017-10-04 15:55:53,"RT @MEsipisu: President @UKenyatta tomorrow starts a campaign blitz that will take him to Kisii, Nyamira, Nyandarua, Meru and Mombasa in le…",0,48,Twitter for iPad,915606409743618048
2017-10-04 13:49:11,Govt to use Kshs 6 billion to buy all maize harvested this season https://t.co/kKpcEEYNFy https://t.co/vREIThyfTb,356,107,Twitter Web Client,915574524300681221
2017-10-04 13:44:39,The policy thrust of the Government is to transform agriculture from subsistence to commercial and market-oriented… https://t.co/Gf0owkgV7f,143,33,Twitter Web Client,915573382065872896
2017-10-04 13:43:04,"In this respect, I urge our exporters to take advantage and make use of it to increase horticultural exports to Eur… https://t.co/XrzEFleqDG",149,32,Twitter Web Client,915572983715987458
2017-10-04 13:42:34,"Indeed, we now have the National Horticulture Traceability System in place. https://t.co/9GIpbnzzQ1",153,39,Twitter Web Client,915572856616030208
2017-10-04 13:42:00,"In regions like Europe where our products faced quality challenges, mechanisms are already in place to address them.",137,30,Twitter Web Client,915572716819935232
2017-10-04 13:41:10,...to ensure that our agricultural products meet highest international standards &amp; attract the markets &amp; prices tha… https://t.co/2bUoJy1NFG,117,34,Twitter Web Client,915572504625844225
2017-10-04 13:39:04,"As a country, we have made great progress in strengthening quality and safety checks.... https://t.co/PwEdZ7D0m1",129,28,Twitter Web Client,915571975443173376
2017-10-04 13:35:03,"But in order to ensure sustainability of this important credit facility, all beneficiaries should strive to repay t… https://t.co/EE73IyhsNd",148,41,Twitter Web Client,915570965064699904
2017-10-04 13:34:29,I urge all the agricultural value chain actors to take advantage of these loans to modernize their operations. https://t.co/KZ1ekQ1NwP,212,69,Twitter Web Client,915570823611764737
2017-10-04 13:22:16,... is underwriting Ksh 270 million to leverage Ksh 1.6 billion to facilitate small-scale farmers to access credit.,142,44,Twitter Web Client,915567748784250885
2017-10-04 13:21:48,"In addition, the Government, through Agriculture Finance Corporation (AFC) and, in partnership with IFAD...",97,29,Twitter Web Client,915567632308477953
2017-10-04 13:19:53,The Government agreed to underwrite loans to the tune of Ksh 300 million and the Bank to lend Ksh 20 billion at 12%… https://t.co/9uMy2dKkPL,173,59,Twitter Web Client,915567149174988801
2017-10-04 13:18:50,"To make it easier for our farmers to secure credit, my Government has signed a Memorandum of Understanding (MoU) wi… https://t.co/7Hnb3BpDAR",318,85,Twitter Web Client,915566884451487745
2017-10-04 13:17:49,Access to credit has been identified as a major factor constraining farming business.,136,30,Twitter Web Client,915566628192096258
